{
  "$schema": "./upstream-sources.schema.json",
  "version": 1,
  "description": "Registry of upstream sources used to MANUALLY enrich OpenHunterAI. This file is reference metadata only. Nothing here is auto-synced, and no source listed here is fetched or executed at runtime by the product. See docs/MANUAL_UPSTREAM_ENRICHMENT_POLICY.md.",
  "defaults": {
    "autoSync": false,
    "canSubmodule": false,
    "canVendorFull": false,
    "importMode": "reference_only",
    "importedBy": "manual_claude_code_run"
  },
  "sources": [
    {
      "id": "openhunter_core",
      "url": "https://github.com/LumosLab-Innovation/OpenHunterAI",
      "ref": "this-repo",
      "role": "Native OpenHunterAI hunters, scan plan, and product logic.",
      "importMode": "native",
      "currentVendorState": "native",
      "isRuntimeDependency": true,
      "canVendorFull": false,
      "canSubmodule": false,
      "allowedUse": ["native_hunters", "scan_plan", "product_logic"],
      "forbiddenUse": []
    },
    {
      "id": "openhack",
      "url": "https://github.com/hadriansecurity/openhack",
      "ref": "e43e4cb2bf8d8810467b987f798304af23dbcdc1",
      "license": "see third_party_research/openhack/LICENSE",
      "role": "Scenario-first workflow, hunter schema, triage/review methodology.",
      "importMode": "reference_only",
      "currentVendorState": "curated_subset_in_third_party_research",
      "vendoredPaths": ["third_party_research/openhack/agents", "third_party_research/openhack/config", "third_party_research/openhack/templates"],
      "isRuntimeDependency": false,
      "canVendorFull": false,
      "canSubmodule": false,
      "allowedUse": ["scenario_workflow", "hunter_schema", "review_methodology"],
      "forbiddenUse": ["runtime_worker", "direct_execution", "new_scope"]
    },
    {
      "id": "strix",
      "url": "https://github.com/usestrix/strix",
      "ref": "cc23eeb65de1bae88ec81dfdae4a9597a6aba1d3",
      "runtimeRef": "v1.6.2",
      "reviewedUpstreamHead": "355a8bb43743ce769e5ff3f72461c07127f3c45c",
      "sandboxRuntimeRef": "ghcr.io/usestrix/strix-sandbox:1.3.0",
      "license": "see third_party_research/strix/LICENSE (Apache-2.0)",
      "role": "Attacker-mindset reasoning, controlled validation planning, runtime adapter (strix CLI behind integrations/strix adapter).",
      "importMode": "reasoning_guide",
      "currentVendorState": "curated_subset_in_third_party_research",
      "vendoredPaths": ["third_party_research/strix/strix/skills"],
      "isRuntimeDependency": true,
      "canVendorFull": false,
      "canSubmodule": false,
      "allowedUse": ["high_reasoning_guides", "controlled_validation_adapter"],
      "forbiddenUse": ["unrestricted_execution", "out_of_scope_scan", "bypass_test_intensity_mode", "bypass_approval_gates"]
    },
    {
      "id": "zap",
      "url": "https://github.com/zaproxy/zaproxy",
      "ref": "ghcr.io/zaproxy/zaproxy:2.17.0",
      "role": "Passive/baseline DAST signal layer.",
      "importMode": "runtime_adapter",
      "currentVendorState": "adapter_runtime_only",
      "vendoredPaths": [],
      "isRuntimeDependency": true,
      "canVendorFull": false,
      "canSubmodule": false,
      "allowedUse": ["passive_baseline_adapter", "alert_parser"],
      "forbiddenUse": ["business_logic_hunter", "active_scan_by_default", "full_vendor"]
    },
    {
      "id": "nuclei",
      "url": "https://github.com/projectdiscovery/nuclei",
      "ref": "projectdiscovery/nuclei:v3.4.10",
      "role": "Known-pattern / exposure / misconfiguration signal layer.",
      "importMode": "curated_content",
      "currentVendorState": "adapter_runtime_only",
      "vendoredPaths": ["integrations/nuclei/templates"],
      "isRuntimeDependency": true,
      "canVendorFull": false,
      "canSubmodule": false,
      "allowedUse": ["curated_template_allowlist", "output_parser"],
      "forbiddenUse": ["full_community_templates_by_default", "active_scan_by_default", "full_vendor"]
    },
    {
      "id": "claude_bughunter",
      "url": "https://github.com/elementalsouls/Claude-BugHunter",
      "ref": "c4c925a21c51e5e5e2e8afa96287ba43fb28cccd",
      "license": "MIT (Copyright (c) 2026 Sachin Sharma)",
      "role": "Reference playbook / skill / validation gate / evidence hygiene / report pattern source. Used only to enrich OpenHack workflow and Strix reasoning guides.",
      "importMode": "reference_only",
      "currentVendorState": "reference_external_only",
      "vendoredPaths": [],
      "isRuntimeDependency": false,
      "canVendorFull": false,
      "canSubmodule": false,
      "allowedUse": ["openhack_playbook_enrichment", "strix_reasoning_guides", "evidence_hygiene", "triage_validation", "report_patterns"],
      "forbiddenUse": ["runtime_worker", "direct_execution", "vendor_full_repo", "new_scope", "out_of_scope_skills"],
      "inScopeSkills": [
        "evidence-hygiene",
        "triage-validation",
        "redteam-mindset",
        "report-writing",
        "hunt-idor",
        "hunt-auth-bypass",
        "hunt-business-logic",
        "hunt-ssrf",
        "hunt-api-misconfig",
        "hunt-llm-ai",
        "hunt-graphql",
        "hunt-cors",
        "hunt-csrf",
        "hunt-open-redirect"
      ],
      "outOfScopeSkillsRejected": [
        "cloud-iam-deep",
        "enterprise-vpn-attack",
        "m365-entra-attack",
        "okta-attack",
        "apk-redteam-pipeline",
        "supply-chain-attack-recon",
        "web3-audit",
        "meme-coin-audit",
        "vmware-vcenter-attack",
        "hunt-sharepoint",
        "hunt-ldap",
        "hunt-ntlm-info",
        "hunt-saml",
        "hunt-k8s",
        "hunt-cicd",
        "offensive-osint"
      ]
    },
    {
      "id": "rea",
      "url": "https://github.com/morluto/rea",
      "ref": "27dc42d10249f0410904a75c0997842eb03b931c",
      "runtimeRef": "rea-agents@6.7.0",
      "reviewedUpstreamHead": "3e7e102a518b9112a2a8aa0590ae6f6951fd0635",
      "reviewedOn": "2026-10-24",
      "reviewedBy": "manual_codex_run",
      "license": "MIT; third-party tools retain their own licenses",
      "role": "Optional pinned local static JavaScript artifact analysis, exposed through openhunterai rea; separate from public website scans.",
      "importMode": "runtime_adapter",
      "currentVendorState": "adapter_runtime_only",
      "vendoredPaths": [],
      "isRuntimeDependency": true,
      "optional": true,
      "canVendorFull": false,
      "canSubmodule": false,
      "allowedUse": ["authorized_local_web_artifact_analysis", "bounded_sanitized_summary", "manual_provenance_review"],
      "forbiddenUse": ["target_code_execution", "unrestricted_mcp_registration", "automatic_finding_promotion", "out_of_scope_scan", "private_network_scan", "full_repo_vendoring", "automatic_upstream_sync"]
    }
  ]
}
